{
  "$schema": "https://json-schema.org/draft/2020-12/schema",
  "title": "DashboardHumanReviewRecord",
  "type": "object",
  "additionalProperties": false,
  "required": ["schema_version", "status", "commit", "reviewer", "scope", "findings", "automated_packet_sha256", "owner_packet_sha256"],
  "properties": {
    "schema_version": {"const": "dashboard-human-review-v1"},
    "status": {"enum": ["pending", "findings_recorded", "approved_within_scope", "rejected"]},
    "commit": {"type": "string", "pattern": "^[0-9a-f]{7,64}$"},
    "reviewer": {"type": "string", "minLength": 1},
    "reviewed_at": {"type": ["string", "null"], "format": "date-time"},
    "automated_packet_sha256": {"type": ["string", "null"], "pattern": "^[0-9a-f]{64}$"},
    "owner_packet_sha256": {"type": ["string", "null"], "pattern": "^[0-9a-f]{64}$"},
    "workflow": {
      "type": "object",
      "additionalProperties": false,
      "required": ["workflow", "run_id", "run_attempt", "artifact_name", "workflow_url"],
      "properties": {
        "workflow": {"type": "string", "minLength": 1},
        "run_id": {"type": "string", "pattern": "^[0-9]+$"},
        "run_attempt": {"type": "string", "pattern": "^[0-9]+$"},
        "artifact_name": {"type": "string", "minLength": 1},
        "workflow_url": {"type": "string", "format": "uri", "pattern": "^https://github\\.com/"}
      }
    },
    "scope": {
      "type": "object",
      "additionalProperties": false,
      "required": ["routes", "browsers", "operating_systems", "assistive_technology", "provenance"],
      "properties": {
        "routes": {
          "type": "array",
          "minItems": 11,
          "maxItems": 11,
          "uniqueItems": true,
          "items": {
            "enum": ["/", "/analyses/", "/analyses/cognitive_vs_procedural_ratio/", "/automation/", "/crosswalks/", "/demonstrators/", "/ontologies/", "/readiness/", "/roadmap/", "/sources/", "/sources/au_mbs/"]
          }
        },
        "browsers": {"type": "array", "minItems": 1, "items": {"type": "string", "minLength": 1}},
        "operating_systems": {"type": "array", "minItems": 1, "items": {"type": "string", "minLength": 1}},
        "assistive_technology": {"type": "array", "minItems": 1, "items": {"type": "string", "minLength": 1}},
        "provenance": {"type": "boolean"},
        "prohibited_content": {"type": "boolean"}
      }
    },
    "findings": {"type": "array", "items": {"type": "string"}},
    "evidence_artifacts": {
      "type": "array",
      "items": {"type": "string", "minLength": 1},
      "uniqueItems": true
    },
    "remediation_or_waiver": {"type": ["string", "null"]},
    "approval_scope": {
      "type": ["string", "null"],
      "not": {
        "type": "string",
        "pattern": "[Ww][Cc][Aa][Gg](\\s+[0-9.]+)?\\s+([Cc][Oo][Mm][Pp][Ll][Ii][Aa][Nn][Tt]|[Cc][Oo][Nn][Ff][Oo][Rr][Mm]([Aa][Nn][Tt]|[Aa][Nn][Cc][Ee]))"
      }
    }
  },
  "allOf": [
    {
      "if": {
        "properties": {"status": {"const": "approved_within_scope"}},
        "required": ["status"]
      },
      "then": {
        "required": ["reviewed_at", "evidence_artifacts", "approval_scope", "automated_packet_sha256", "owner_packet_sha256"],
        "properties": {
          "reviewed_at": {"type": "string", "format": "date-time"},
          "automated_packet_sha256": {"type": "string", "pattern": "^[0-9a-f]{64}$"},
          "owner_packet_sha256": {"type": "string", "pattern": "^[0-9a-f]{64}$"},
          "evidence_artifacts": {"minItems": 1},
          "approval_scope": {"type": "string", "minLength": 1},
          "scope": {
            "required": ["prohibited_content"],
            "properties": {
              "provenance": {"const": true},
              "prohibited_content": {"const": true}
            }
          }
        }
      }
    }
  ]
}
